answer,sentiment,linear_svm,nearest_neighbors,rbf_svm,gaussian_process,decision_tree,random_forest,neural_net,ada_boost,naive_bayes,qda,gradient_boosting,logistic_regression,linear_svm_proba,nearest_neighbors_proba,rbf_svm_proba,gaussian_process_proba,decision_tree_proba,random_forest_proba,neural_net_proba,ada_boost_proba,naive_bayes_proba,qda_proba,gradient_boosting_proba,logistic_regression_proba
"native landscaping uses much less water, and still provides cooling effects, co2 exchange and shade ",1,1,1,1,1,1,1,1,1,1,-1,1,1,[0.02961709 0.97038291],[0. 1.],[0.34414236 0.65585764],[0.22291578 0.77708422],[0. 1.],[0.02857143 0.97142857],[0.03335681 0.96664319],[2.22044605e-16 1.00000000e+00],[0. 1.],[nan nan],[1.54489359e-05 9.99984551e-01],[0.06190137 0.93809863]
i would like to see the commuter cars china has that are small battery powered cars promoted ,-1,-1,-1,1,-1,-1,-1,-1,-1,-1,-1,-1,-1,[0.96962681 0.03037319],[1. 0.],[0.34413199 0.65586801],[0.82662772 0.17337228],[1. 0.],[0.86190476 0.13809524],[0.96987924 0.03012076],[1.00000000e+00 2.22044605e-16],[1. 0.],[nan nan],[9.99971983e-01 2.80170609e-05],[0.93341662 0.06658338]
my natural gas bill is consistently the most inexpensive bill i get  why aren t there more questions on affordability ,-1,-1,-1,1,-1,-1,-1,-1,-1,1,-1,-1,-1,[0.96856325 0.03143675],[0.66666667 0.33333333],[0.34414236 0.65585764],[0.67688154 0.32311846],[1. 0.],[0.82857143 0.17142857],[0.92721133 0.07278867],[1.00000000e+00 2.22044605e-16],[0. 1.],[nan nan],[9.99971983e-01 2.80170609e-05],[0.89435275 0.10564725]
legalize and promote humanure  composting of human waste on site rather than flushing 10 gallons of precious drinking water a day! ,1,1,1,1,1,1,1,1,1,1,-1,1,1,[0.0125075 0.9874925],[0. 1.],[0.34414259 0.65585741],[0.12049958 0.87950042],[0. 1.],[0.07222222 0.92777778],[0.00561475 0.99438525],[2.22044605e-16 1.00000000e+00],[0. 1.],[nan nan],[1.54489359e-05 9.99984551e-01],[0.01363973 0.98636027]
programs that help residents and commercial owners reduce water use ,-1,-1,-1,1,-1,-1,-1,-1,-1,-1,-1,-1,-1,[0.97224632 0.02775368],[1. 0.],[0.34110714 0.65889286],[0.86754287 0.13245713],[1. 0.],[0.76190476 0.23809524],[0.97326457 0.02673543],[1.00000000e+00 2.22044605e-16],[1. 0.],[nan nan],[9.99971983e-01 2.80170609e-05],[0.93674493 0.06325507]
water is a much bigger problem than this survey really allowed for  please take into account the reality of our overuse of water and the decreasing availability of it there wont be more for us to take eg from the colorado,1,1,-1,1,1,1,1,1,1,1,-1,1,1,[0.02978288 0.97021712],[0.66666667 0.33333333],[0.34414236 0.65585764],[0.30737989 0.69262011],[0. 1.],[0. 1.],[0.01813371 0.98186629],[2.22044605e-16 1.00000000e+00],[0. 1.],[nan nan],[1.54489359e-05 9.99984551e-01],[0.04443763 0.95556237]
"hiring and training landscape crews that know how to properly prune native trees and shrubs, maintain native landscape and identify native plants ",1,1,1,1,1,1,1,1,1,1,-1,1,1,[0.03246377 0.96753623],[0. 1.],[0.34414237 0.65585763],[0.23489372 0.76510628],[0. 1.],[0.13333333 0.86666667],[0.03237739 0.96762261],[2.22044605e-16 1.00000000e+00],[0. 1.],[nan nan],[1.54489359e-05 9.99984551e-01],[0.06305164 0.93694836]
i don t see how a massive tree planting program for the city can ever be successful until a solution for this problem is found ,-1,-1,-1,1,-1,-1,-1,-1,-1,-1,-1,-1,-1,[0.9495457 0.0504543],[1. 0.],[0.34414233 0.65585767],[0.79483209 0.20516791],[1. 0.],[0.85972222 0.14027778],[0.95173389 0.04826611],[1.00000000e+00 2.22044605e-16],[1. 0.],[nan nan],[9.99971983e-01 2.80170609e-05],[0.89856498 0.10143502]
maybe start with drought adapted native street trees that are watered at city expense  or charge low income residents low water fees if they plant desert trees ,1,1,1,1,1,1,1,1,1,1,-1,1,1,[0.03610534 0.96389466],[0. 1.],[0.34414236 0.65585764],[0.21707329 0.78292671],[0. 1.],[0.13222222 0.86777778],[0.02450866 0.97549134],[2.22044605e-16 1.00000000e+00],[0. 1.],[nan nan],[1.54489359e-05 9.99984551e-01],[0.05616968 0.94383032]
"have more programs like las milpitas that s through the food bank  while there are community gardens around town, they are expensive and not very accessible ",1,1,1,1,1,1,1,1,1,1,-1,1,1,[0.02346462 0.97653538],[0.33333333 0.66666667],[0.34414236 0.65585764],[0.28778655 0.71221345],[0. 1.],[0.33222222 0.66777778],[0.01320761 0.98679239],[2.22044605e-16 1.00000000e+00],[0. 1.],[nan nan],[1.54489359e-05 9.99984551e-01],[0.02601632 0.97398368]
promoting local food production for individual households will improve food security and reduce our community s carbon footprint  ,1,1,1,1,1,1,1,1,1,1,-1,1,1,[0.02948281 0.97051719],[0. 1.],[0.34416924 0.65583076],[0.14634787 0.85365213],[0. 1.],[0.12857143 0.87142857],[0.01998287 0.98001713],[2.22044605e-16 1.00000000e+00],[0. 1.],[nan nan],[1.54489359e-05 9.99984551e-01],[0.04667917 0.95332083]
"explain why things are being changed, to create buy in from the community  ",1,1,1,1,1,1,1,1,1,1,-1,1,1,[0.02324045 0.97675955],[0. 1.],[0.34414701 0.65585299],[0.1501864 0.8498136],[0. 1.],[0.2 0.8],[0.0169901 0.9830099],[2.22044605e-16 1.00000000e+00],[0. 1.],[nan nan],[1.54489359e-05 9.99984551e-01],[0.04078613 0.95921387]
"i already have solar panels, i have several citrus trees and many rose bushes  i do what i can",1,1,1,1,1,1,1,1,1,1,-1,1,1,[0.07990512 0.92009488],[0.33333333 0.66666667],[0.34414236 0.65585764],[0.37733126 0.62266874],[0. 1.],[0.23333333 0.76666667],[0.12840821 0.87159179],[2.22044605e-16 1.00000000e+00],[0. 1.],[nan nan],[1.54489359e-05 9.99984551e-01],[0.18254208 0.81745792]
the city needs more open green spaces where trees can grow  our green space % is awful  this greening would reduce the heat island effect  the domino of lowering our cooling energy needs which lowers polluting emissions from power ,1,1,1,1,1,1,1,1,1,1,-1,1,1,[0.02134739 0.97865261],[0.33333333 0.66666667],[0.34414236 0.65585764],[0.29024361 0.70975639],[0. 1.],[0. 1.],[0.00934985 0.99065015],[2.22044605e-16 1.00000000e+00],[0. 1.],[nan nan],[1.54489359e-05 9.99984551e-01],[0.01771836 0.98228164]
reverse descrimation is still descrimination and just as wrong as any descriminating!,1,1,1,1,1,1,1,1,1,1,-1,1,1,[0.02075539 0.97924461],[0. 1.],[0.34414268 0.65585732],[0.18270442 0.81729558],[0. 1.],[0.12857143 0.87142857],[0.01806898 0.98193102],[2.22044605e-16 1.00000000e+00],[0. 1.],[nan nan],[1.54489359e-05 9.99984551e-01],[0.03851008 0.96148992]
no grass orpine trees,-1,-1,-1,1,-1,-1,-1,-1,-1,-1,-1,-1,-1,[0.97083347 0.02916653],[0.66666667 0.33333333],[0.33632746 0.66367254],[0.85651539 0.14348461],[1. 0.],[0.82857143 0.17142857],[0.96831925 0.03168075],[1.00000000e+00 2.22044605e-16],[1. 0.],[nan nan],[9.99971983e-01 2.80170609e-05],[0.93218628 0.06781372]
stop doing feel good stuff and hire more police to take care of the poor service in tucson ,1,1,1,1,1,1,1,1,1,1,-1,1,1,[0.01511457 0.98488543],[0. 1.],[0.34414237 0.65585763],[0.12234111 0.87765889],[0. 1.],[0.1 0.9],[0.01000429 0.98999571],[2.22044605e-16 1.00000000e+00],[0. 1.],[nan nan],[1.54489359e-05 9.99984551e-01],[0.02189026 0.97810974]
"tree planting, green space, restrict new development that requires new water use",1,1,1,1,1,1,1,1,1,1,-1,1,1,[0.02411615 0.97588385],[0. 1.],[0.34414824 0.65585176],[0.15507374 0.84492626],[0. 1.],[0.02857143 0.97142857],[0.01975084 0.98024916],[2.22044605e-16 1.00000000e+00],[0. 1.],[nan nan],[1.54489359e-05 9.99984551e-01],[0.04270545 0.95729455]
gratitude for the survey and the efforts of mayor and council ,1,1,1,1,1,1,1,1,1,1,-1,1,1,[0.03150815 0.96849185],[0. 1.],[0.34440465 0.65559535],[0.16031238 0.83968762],[0. 1.],[0.07222222 0.92777778],[0.02589965 0.97410035],[2.22044605e-16 1.00000000e+00],[0. 1.],[nan nan],[1.54489359e-05 9.99984551e-01],[0.06032376 0.93967624]
thank you for your progressive policies  this is one of the big reasons why i decided to move my family to tucson ,1,1,1,1,1,1,1,1,1,1,-1,1,1,[0.0568386 0.9431614],[0. 1.],[0.34414236 0.65585764],[0.2673499 0.7326501],[0. 1.],[0.07222222 0.92777778],[0.03112384 0.96887616],[2.22044605e-16 1.00000000e+00],[0. 1.],[nan nan],[1.54489359e-05 9.99984551e-01],[0.06765036 0.93234964]
work with hoas that require plants to either reduce required number of plants and or promote desert plants that do not use much water ,1,1,1,1,1,1,1,1,1,1,-1,1,1,[0.02292698 0.97707302],[0. 1.],[0.34416206 0.65583794],[0.13566767 0.86433233],[0. 1.],[0.03333333 0.96666667],[0.02107742 0.97892258],[2.22044605e-16 1.00000000e+00],[0. 1.],[nan nan],[1.54489359e-05 9.99984551e-01],[0.04435232 0.95564768]
we have got to stop wasting water  tucson will be a ghost town if we run out of water  let s start with changing our toilet habits to dry composting  or flush toilets with waste water from sink showers ,1,1,1,1,1,1,1,1,1,1,-1,1,1,[0.02405363 0.97594637],[0. 1.],[0.34414236 0.65585764],[0.21415802 0.78584198],[0. 1.],[0. 1.],[0.01231512 0.98768488],[2.22044605e-16 1.00000000e+00],[0. 1.],[nan nan],[1.54489359e-05 9.99984551e-01],[0.02537609 0.97462391]
"common sense is hard to find  reuse phoenix waste water, plant trees, harvest sun and rain, electrify bus routes  no batteries  don t put on a super hero cape and roll out disastrous policies in the name of the environment ",-1,-1,-1,1,-1,-1,-1,-1,-1,1,-1,-1,-1,[0.96276431 0.03723569],[0.66666667 0.33333333],[0.34414236 0.65585764],[0.6435649 0.3564351],[1. 0.],[0.8875 0.1125],[0.91152479 0.08847521],[1.00000000e+00 2.22044605e-16],[0. 1.],[nan nan],[9.99971983e-01 2.80170609e-05],[0.87676841 0.12323159]
