answer,sentiment,water,citi,use,tree,plant,need,wast,take,compost,peopl,tucson,green,would,promot,program,chang,look,climat,one,information_technolog,communiti,much,make,mani,solar,stop,shade,reduc,mayor,contain,bus,food,avail,landscap,support,resid,space,servic,get,public,low,advertis,place,afford,govern,like,car,group,provid,energi,heat,incom,problem,put,success,citizen,solut,see,bill,grass,plastic,equiti,part,exist,plan,constitut,also,iodin,encourag,good,us,cat,black,recycl,educ
plant shade tree along citi walk reduc temp chang road black asphalt someth lighter less heat retain,Positivo,No,Yes,No,Yes,Yes,No,No,No,No,No,No,No,No,No,No,Yes,No,No,No,No,No,No,No,No,No,No,Yes,Yes,No,No,No,No,No,No,No,No,No,No,No,No,No,No,No,No,No,No,No,No,No,No,Yes,No,No,No,No,No,No,No,No,No,No,No,No,No,No,No,No,No,No,No,No,No,Yes,No,No
tucson part walkabl done encourag less person auto use also look safeti astound number accid pedestrian involv disgrac,Negativo,No,No,Yes,No,No,No,No,No,No,No,Yes,No,No,No,No,No,Yes,No,No,No,No,No,No,No,No,No,No,No,No,No,No,No,No,No,No,No,No,No,No,No,No,No,No,No,No,No,No,No,No,No,No,No,No,No,No,No,No,No,No,No,No,No,Yes,No,No,No,Yes,No,Yes,No,No,No,No,No,No
tree plant green space restrict new develop requir new water use,Positivo,Yes,No,Yes,Yes,Yes,No,No,No,No,No,No,Yes,No,No,No,No,No,No,No,No,No,No,No,No,No,No,No,No,No,No,No,No,No,No,No,No,Yes,No,No,No,No,No,No,No,No,No,No,No,No,No,No,No,No,No,No,No,No,No,No,No,No,No,No,No,No,No,No,No,No,No,No,No,No,No,No
truli seem vehicl pollut tucson major problem affect qualiti air breath daili basi,Positivo,No,No,No,No,No,No,No,No,No,No,Yes,No,No,No,No,No,No,No,No,No,No,No,No,No,No,No,No,No,No,No,No,No,No,No,No,No,No,No,No,No,No,No,No,No,No,No,No,No,No,No,No,No,Yes,No,No,No,No,No,No,No,No,No,No,No,No,No,No,No,No,No,No,No,No,No,No
encourag promot altern form `` green `` transport throughout citi effect market altern help peopl reach destin without pollut environ,Positivo,No,Yes,No,No,No,No,No,No,No,Yes,No,Yes,No,Yes,No,No,No,No,No,No,No,No,No,No,No,No,No,No,No,No,No,No,No,No,No,No,No,No,No,No,No,No,No,No,No,No,No,No,No,No,No,No,No,No,No,No,No,No,No,No,No,No,No,No,No,No,No,No,Yes,No,No,No,No,No,No
walkabl space complet close street car make bicycl walk space prioriti vehicl traffic mani area,Positivo,No,No,No,No,No,No,No,No,No,No,No,No,No,No,No,No,No,No,No,No,No,No,Yes,Yes,No,No,No,No,No,No,No,No,No,No,No,No,Yes,No,No,No,No,No,No,No,No,No,Yes,No,No,No,No,No,No,No,No,No,No,No,No,No,No,No,No,No,No,No,No,No,No,No,No,No,No,No,No
support green job industri train program adult educ program jted/ct communiti colleg univers cours,Positivo,No,No,No,No,No,No,No,No,No,No,No,Yes,No,No,Yes,No,No,No,No,No,Yes,No,No,No,No,No,No,No,No,No,No,No,No,No,Yes,No,No,No,No,No,No,No,No,No,No,No,No,No,No,No,No,No,No,No,No,No,No,No,No,No,No,No,No,No,No,No,No,No,No,No,No,No,No,No,Yes
insul communiti citi larg scale solar rather rooftop water effici program save energi emiss pump pool pretti much everyth propos project drawdown drawdown.org,Positivo,Yes,Yes,No,No,No,No,No,No,No,No,No,No,No,No,Yes,No,No,No,No,No,Yes,Yes,No,No,Yes,No,No,No,No,No,No,No,No,No,No,No,No,No,No,No,No,No,No,No,No,No,No,No,No,Yes,No,No,No,No,No,No,No,No,No,No,No,No,No,No,No,No,No,No,No,No,No,No,No,No,No
fix street road work stuff,Positivo,No,No,No,No,No,No,No,No,No,No,No,No,No,No,No,No,No,No,No,No,No,No,No,No,No,No,No,No,No,No,No,No,No,No,No,No,No,No,No,No,No,No,No,No,No,No,No,No,No,No,No,No,No,No,No,No,No,No,No,No,No,No,No,No,No,No,No,No,No,No,No,No,No,No,No
take care park recreat area maintain,Positivo,No,No,No,No,No,No,No,Yes,No,No,No,No,No,No,No,No,No,No,No,No,No,No,No,No,No,No,No,No,No,No,No,No,No,No,No,No,No,No,No,No,No,No,No,No,No,No,No,No,No,No,No,No,No,No,No,No,No,No,No,No,No,No,No,No,No,No,No,No,No,No,No,No,No,No,No
stop feel good stuff hire polic take care poor servic tucson,Positivo,No,No,No,No,No,No,No,Yes,No,No,Yes,No,No,No,No,No,No,No,No,No,No,No,No,No,No,Yes,No,No,No,No,No,No,No,No,No,No,No,Yes,No,No,No,No,No,No,No,No,No,No,No,No,No,No,No,No,No,No,No,No,No,No,No,No,No,No,No,No,No,No,No,Yes,No,No,No,No,No
money go improv tucson 's qualiti life,Positivo,No,No,No,No,No,No,No,No,No,No,Yes,No,No,No,No,No,No,No,No,No,No,No,No,No,No,No,No,No,No,No,No,No,No,No,No,No,No,No,No,No,No,No,No,No,No,No,No,No,No,No,No,No,No,No,No,No,No,No,No,No,No,No,No,No,No,No,No,No,No,No,No,No,No,No,No
rain water catchment throughout urban landscap park use plant water citi build indoor water use golf cours riverway,Positivo,Yes,Yes,Yes,No,Yes,No,No,No,No,No,No,No,No,No,No,No,No,No,No,No,No,No,No,No,No,No,No,No,No,No,No,No,No,Yes,No,No,No,No,No,No,No,No,No,No,No,No,No,No,No,No,No,No,No,No,No,No,No,No,No,No,No,No,No,No,No,No,No,No,No,No,No,No,No,No,No
along major road corridor could add solar roof tunnel catch sun divert rain catchment sourc control person home water use allow,Positivo,Yes,No,Yes,No,No,No,No,No,No,No,No,No,No,No,No,No,No,No,No,No,No,No,No,No,Yes,No,No,No,No,No,No,No,No,No,No,No,No,No,No,No,No,No,No,No,No,No,No,No,No,No,No,No,No,No,No,No,No,No,No,No,No,No,No,No,No,No,No,No,No,No,No,No,No,No,No
fine grass landscap water use incl golf cours n't enough water need aggress protect usag,Negativo,Yes,No,Yes,No,No,Yes,No,No,No,No,No,No,No,No,No,No,No,No,No,No,No,No,No,No,No,No,No,No,No,No,No,No,No,Yes,No,No,No,No,No,No,No,No,No,No,No,No,No,No,No,No,No,No,No,No,No,No,No,No,No,Yes,No,No,No,No,No,No,No,No,No,No,No,No,No,No,No
asid vehicular emiss heating/cool resid huge opportun reduc energi consumpt need creat strong incent peopl energi effici work done exist structur,Positivo,No,No,No,No,No,Yes,No,No,No,Yes,No,No,No,No,No,No,No,No,No,No,No,No,No,No,No,No,No,Yes,No,No,No,No,No,No,No,Yes,No,No,No,No,No,No,No,No,No,No,No,No,No,Yes,No,No,No,No,No,No,No,No,No,No,No,No,No,Yes,No,No,No,No,No,No,No,No,No,No,No
think state tax credit avail work similar credit avail state feder level electr vehicl purchas instal charger infrastructur,Negativo,No,No,No,No,No,No,No,No,No,No,No,No,No,No,No,No,No,No,No,No,No,No,No,No,No,No,No,No,No,No,No,No,Yes,No,No,No,No,No,No,No,No,No,No,No,No,No,No,No,No,No,No,No,No,No,No,No,No,No,No,No,No,No,No,No,No,No,No,No,No,No,No,No,No,No,No
race climat chang look forward sun heat get nice tan,Negativo,No,No,No,No,No,No,No,No,No,No,No,No,No,No,No,Yes,Yes,Yes,No,No,No,No,No,No,No,No,No,No,No,No,No,No,No,No,No,No,No,No,Yes,No,No,No,No,No,No,No,No,No,No,No,Yes,No,No,No,No,No,No,No,No,No,No,No,No,No,No,No,No,No,No,No,No,No,No,No,No
mismanag nation forest huge caus increas wildfir,Negativo,No,No,No,No,No,No,No,No,No,No,No,No,No,No,No,No,No,No,No,No,No,No,No,No,No,No,No,No,No,No,No,No,No,No,No,No,No,No,No,No,No,No,No,No,No,No,No,No,No,No,No,No,No,No,No,No,No,No,No,No,No,No,No,No,No,No,No,No,No,No,No,No,No,No,No
got stop wast water tucson ghost town run water let 's start chang toilet habit dri compost flush toilet wast water sink/show,Positivo,Yes,No,No,No,No,No,Yes,No,Yes,No,Yes,No,No,No,No,Yes,No,No,No,No,No,No,No,No,No,Yes,No,No,No,No,No,No,No,No,No,No,No,No,No,No,No,No,No,No,No,No,No,No,No,No,No,No,No,No,No,No,No,No,No,No,No,No,No,No,No,No,No,No,No,No,No,No,No,No,No
build water catch gutter contain slow water plant area get rid heat bubbl black tar asphalt,Negativo,Yes,No,No,No,Yes,No,No,No,No,No,No,No,No,No,No,No,No,No,No,No,No,No,No,No,No,No,No,No,No,Yes,No,No,No,No,No,No,No,No,Yes,No,No,No,No,No,No,No,No,No,No,No,Yes,No,No,No,No,No,No,No,No,No,No,No,No,No,No,No,No,No,No,No,No,No,Yes,No,No
invest green infrastructur result job help economi,Negativo,No,No,No,No,No,No,No,No,No,No,No,Yes,No,No,No,No,No,No,No,No,No,No,No,No,No,No,No,No,No,No,No,No,No,No,No,No,No,No,No,No,No,No,No,No,No,No,No,No,No,No,No,No,No,No,No,No,No,No,No,No,No,No,No,No,No,No,No,No,No,No,No,No,No,No,No
abund public educ climat chang econom qualiti life co-benefit mitig adapt climat chang,Positivo,No,No,No,No,No,No,No,No,No,No,No,No,No,No,No,Yes,No,Yes,No,No,No,No,No,No,No,No,No,No,No,No,No,No,No,No,No,No,No,No,No,Yes,No,No,No,No,No,No,No,No,No,No,No,No,No,No,No,No,No,No,No,No,No,No,No,No,No,No,No,No,No,No,No,No,No,No,Yes
robust public awar campaign extrem heat season better drought emerg preparedn put mandatori measur lower drought stage better prepar tucson resid potenti water shortag,Positivo,Yes,No,No,No,No,No,No,No,No,No,Yes,No,No,No,No,No,No,No,No,No,No,No,No,No,No,No,No,No,No,No,No,No,No,No,No,Yes,No,No,No,Yes,No,No,No,No,No,No,No,No,No,No,Yes,No,No,Yes,No,No,No,No,No,No,No,No,No,No,No,No,No,No,No,No,No,No,No,No,No
far extens public involv climat chang plan enhanc city-counti cooper coordin climat plan n't count tree plant panacea,Positivo,No,No,No,Yes,Yes,No,No,No,No,No,No,No,No,No,No,Yes,No,Yes,No,No,No,No,No,No,No,No,No,No,No,No,No,No,No,No,No,No,No,No,No,Yes,No,No,No,No,No,No,No,No,No,No,No,No,No,No,No,No,No,No,No,No,No,No,No,No,Yes,No,No,No,No,No,No,No,No,No,No
provid benefit histor disadvantag group mean racial equiti environ unclear implement would impact decis made,Negativo,No,No,No,No,No,No,No,No,No,No,No,No,Yes,No,No,No,No,No,No,No,No,No,No,No,No,No,No,No,No,No,No,No,No,No,No,No,No,No,No,No,No,No,No,No,No,No,No,Yes,Yes,No,No,No,No,No,No,No,No,No,No,No,No,Yes,No,No,No,No,No,No,No,No,No,No,No,No,No
need residenti solar subsidi smaller hous option around - sq feet multi-famili,Positivo,No,No,No,No,No,Yes,No,No,No,No,No,No,No,No,No,No,No,No,No,No,No,No,No,No,Yes,No,No,No,No,No,No,No,No,No,No,No,No,No,No,No,No,No,No,No,No,No,No,No,No,No,No,No,No,No,No,No,No,No,No,No,No,No,No,No,No,No,No,No,No,No,No,No,No,No,No
citi need open green space tree grow green space aw green would reduc heat island effect domino lower cool energi need lower pollut emiss power,Positivo,No,Yes,No,Yes,No,Yes,No,No,No,No,No,Yes,Yes,No,No,No,No,No,No,No,No,No,No,No,No,No,No,Yes,No,No,No,No,No,No,No,No,Yes,No,No,No,No,No,No,No,No,No,No,No,No,Yes,Yes,No,No,No,No,No,No,No,No,No,No,No,No,No,No,No,No,No,No,No,No,No,No,No,No
water long term concern due need state wide solut look israel need take phoenix 's wast water treat farmer irrig instead potabl water steal,Positivo,Yes,No,No,No,No,Yes,Yes,Yes,No,No,No,No,No,No,No,No,Yes,No,No,No,No,No,No,No,No,No,No,No,No,No,No,No,No,No,No,No,No,No,No,No,No,No,No,No,No,No,No,No,No,No,No,No,No,No,No,No,Yes,No,No,No,No,No,No,No,No,No,No,No,No,No,No,No,No,No,No
volunt base help teach strategi appli within communiti,Positivo,No,No,No,No,No,No,No,No,No,No,No,No,No,No,No,No,No,No,No,No,Yes,No,No,No,No,No,No,No,No,No,No,No,No,No,No,No,No,No,No,No,No,No,No,No,No,No,No,No,No,No,No,No,No,No,No,No,No,No,No,No,No,No,No,No,No,No,No,No,No,No,No,No,No,No,No
volunt group receiv az benefit unemploy requir learn implement strategi within citi,Positivo,No,Yes,No,No,No,No,No,No,No,No,No,No,No,No,No,No,No,No,No,No,No,No,No,No,No,No,No,No,No,No,No,No,No,No,No,No,No,No,No,No,No,No,No,No,No,No,No,Yes,No,No,No,No,No,No,No,No,No,No,No,No,No,No,No,No,No,No,No,No,No,No,No,No,No,No,No
explain thing chang creat buy-in communiti,Positivo,No,No,No,No,No,No,No,No,No,No,No,No,No,No,No,Yes,No,No,No,No,Yes,No,No,No,No,No,No,No,No,No,No,No,No,No,No,No,No,No,No,No,No,No,No,No,No,No,No,No,No,No,No,No,No,No,No,No,No,No,No,No,No,No,No,No,No,No,No,No,No,No,No,No,No,No,No
resourc use resourc use matter use imper afford equiti opportun underrepres group major group,Negativo,No,No,Yes,No,No,No,No,No,No,No,No,No,No,No,No,No,No,No,No,No,No,No,No,No,No,No,No,No,No,No,No,No,No,No,No,No,No,No,No,No,No,No,No,Yes,No,No,No,Yes,No,No,No,No,No,No,No,No,No,No,No,No,No,Yes,No,No,No,No,No,No,No,No,No,No,No,No,No
equiti tackl climat resili challeng unit effect front addit strong encourag implement food wast reduct plan simultan reduc demand landfil feed need,Positivo,No,No,No,No,No,Yes,Yes,No,No,No,No,No,No,No,No,No,No,Yes,No,No,No,No,No,No,No,No,No,Yes,No,No,No,Yes,No,No,No,No,No,No,No,No,No,No,No,No,No,No,No,No,No,No,No,No,No,No,No,No,No,No,No,No,No,Yes,No,No,Yes,No,No,No,Yes,No,No,No,No,No,No
also support tree planting/re-green must emphas plan collabor ecologists/botanist appropri speci b appropri local growth maxim,Positivo,No,No,No,Yes,No,No,No,No,No,No,No,Yes,No,No,No,No,No,No,No,No,No,No,No,No,No,No,No,No,No,No,No,No,No,No,Yes,No,No,No,No,No,No,No,No,No,No,No,No,No,No,No,No,No,No,No,No,No,No,No,No,No,No,No,No,No,Yes,No,Yes,No,No,No,No,No,No,No,No
citi tucson must provid support legal citizen support program refuge illeg immigr,Negativo,No,Yes,No,No,No,No,No,No,No,No,Yes,No,No,No,Yes,No,No,No,No,No,No,No,No,No,No,No,No,No,No,No,No,No,No,No,Yes,No,No,No,No,No,No,No,No,No,No,No,No,No,Yes,No,No,No,No,No,No,Yes,No,No,No,No,No,No,No,No,No,No,No,No,No,No,No,No,No,No,No
homeless issu complex support afford hous increas mental health/publ health option homeless need avail also public shower place peopl get clean cloth council etc,Positivo,No,No,No,No,No,Yes,No,No,No,Yes,No,No,No,No,No,No,No,No,No,No,No,No,No,No,No,No,No,No,No,No,No,No,Yes,No,Yes,No,No,No,Yes,Yes,No,No,Yes,Yes,No,No,No,No,No,No,No,No,No,No,No,No,No,No,No,No,No,No,No,No,No,No,Yes,No,No,No,No,No,No,No,No
step transpar honesti equiti bid contract process depart,Positivo,No,No,No,No,No,No,No,No,No,No,No,No,No,No,No,No,No,No,No,No,No,No,No,No,No,No,No,No,No,No,No,No,No,No,No,No,No,No,No,No,No,No,No,No,No,No,No,No,No,No,No,No,No,No,No,No,No,No,No,No,No,Yes,No,No,No,No,No,No,No,No,No,No,No,No,No
revers descrim still descrimin wrong descrimin,Positivo,No,No,No,No,No,No,No,No,No,No,No,No,No,No,No,No,No,No,No,No,No,No,No,No,No,No,No,No,No,No,No,No,No,No,No,No,No,No,No,No,No,No,No,No,No,No,No,No,No,No,No,No,No,No,No,No,No,No,No,No,No,No,No,No,No,No,No,No,No,No,No,No,No,No,No
program like las milpita 's food bank communiti garden around town expens access,Positivo,No,No,No,No,No,No,No,No,No,No,No,No,No,No,Yes,No,No,No,No,No,Yes,No,No,No,No,No,No,No,No,No,No,Yes,No,No,No,No,No,No,No,No,No,No,No,No,No,Yes,No,No,No,No,No,No,No,No,No,No,No,No,No,No,No,No,No,No,No,No,No,No,No,No,No,No,No,No,No
promot local food product individu household improv food secur reduc communiti 's carbon footprint,Positivo,No,No,No,No,No,No,No,No,No,No,No,No,No,Yes,No,No,No,No,No,No,Yes,No,No,No,No,No,No,Yes,No,No,No,Yes,No,No,No,No,No,No,No,No,No,No,No,No,No,No,No,No,No,No,No,No,No,No,No,No,No,No,No,No,No,No,No,No,No,No,No,No,No,No,No,No,No,No,No
citi care tri solv problem disadvantag mani servic success provid ngos/non-profit citi 's role social servic agenc play robin hood,Negativo,No,Yes,No,No,No,No,No,No,No,No,No,No,No,No,No,No,No,No,No,No,No,No,No,Yes,No,No,No,No,No,No,No,No,No,No,No,No,No,Yes,No,No,No,No,No,No,No,No,No,No,Yes,No,No,No,Yes,No,Yes,No,No,No,No,No,No,No,No,No,No,No,No,No,No,No,No,No,No,No,No
support human develop segreg develop one planet anyon tri put us human kind self stop mad bash come togeth great tucson futur,Positivo,No,No,No,No,No,No,No,No,No,No,Yes,No,No,No,No,No,No,No,Yes,No,No,No,No,No,No,Yes,No,No,No,No,No,No,No,No,Yes,No,No,No,No,No,No,No,No,No,No,No,No,No,No,No,No,No,No,Yes,No,No,No,No,No,No,No,No,No,No,No,No,No,No,No,No,Yes,No,No,No,No
afford need protect vulner popul provid afford essenti servic charg peopl much energi rooftop solar great 's also expens,Positivo,No,No,No,No,No,Yes,No,No,No,Yes,No,No,No,No,No,No,No,No,No,No,No,Yes,No,No,Yes,No,No,No,No,No,No,No,No,No,No,No,No,Yes,No,No,No,No,No,Yes,No,No,No,No,Yes,Yes,No,No,No,No,No,No,No,No,No,No,No,No,No,No,No,No,Yes,No,No,No,No,No,No,No,No
natur gas bill consist inexpens bill get n't question afford,Negativo,No,No,No,No,No,No,No,No,No,No,No,No,No,No,No,No,No,No,No,No,No,No,No,No,No,No,No,No,No,No,No,No,No,No,No,No,No,No,Yes,No,No,No,No,Yes,No,No,No,No,No,No,No,No,No,No,No,No,No,No,Yes,No,No,No,No,No,No,No,No,No,No,No,No,No,No,No,No
low incom neighborhood focus tree-plant cool roof/pav citi wide proplemsand area tucson need implement infrastructur would includ low incom area,Positivo,No,Yes,No,Yes,Yes,Yes,No,No,No,No,Yes,No,Yes,No,No,No,No,No,No,No,No,No,No,No,No,No,No,No,No,No,No,No,No,No,No,No,No,No,No,No,Yes,No,No,No,No,No,No,No,No,No,No,Yes,No,No,No,No,No,No,No,No,No,No,No,No,No,No,No,No,No,No,No,No,No,No,No
stop plant palo verd tree citi mani peopl allerg,Negativo,No,Yes,No,Yes,Yes,No,No,No,No,Yes,No,No,No,No,No,No,No,No,No,No,No,No,No,Yes,No,Yes,No,No,No,No,No,No,No,No,No,No,No,No,No,No,No,No,No,No,No,No,No,No,No,No,No,No,No,No,No,No,No,No,No,No,No,No,No,No,No,No,No,No,No,No,No,No,No,No,No
mean `` promot `` offer tax incent languag incred fuzzi see govern rhetor design make look like someon someth make possibl meet committe paper written get public accomplish absolut noth peopl,Negativo,No,No,No,No,No,No,No,No,No,Yes,No,No,No,Yes,No,No,Yes,No,No,No,No,No,Yes,No,No,No,No,No,No,No,No,No,No,No,No,No,No,No,Yes,Yes,No,No,No,No,Yes,Yes,No,No,No,No,No,No,No,No,No,No,No,Yes,No,No,No,No,No,No,No,No,No,No,No,No,No,No,No,No,No
work hoa requir plant either reduc requir number plant and/or promot desert plant use much water,Positivo,Yes,No,Yes,No,Yes,No,No,No,No,No,No,No,No,Yes,No,No,No,No,No,No,No,Yes,No,No,No,No,No,Yes,No,No,No,No,No,No,No,No,No,No,No,No,No,No,No,No,No,No,No,No,No,No,No,No,No,No,No,No,No,No,No,No,No,No,No,No,No,No,No,No,No,No,No,No,No,No,No
regul golf cours use larg amount water reduc cost solar panel work hoa promot use solar panel,Positivo,Yes,No,Yes,No,No,No,No,No,No,No,No,No,No,Yes,No,No,No,No,No,No,No,No,No,No,Yes,No,No,Yes,No,No,No,No,No,No,No,No,No,No,No,No,No,No,No,No,No,No,No,No,No,No,No,No,No,No,No,No,No,No,No,No,No,No,No,No,No,No,No,No,No,No,No,No,No,No,No
china chang electr car batteri chang station elimin wait long period charg need huge number charg station roller shield solar tube light promot,Positivo,No,No,No,No,No,Yes,No,No,No,No,No,No,No,Yes,No,Yes,No,No,No,No,No,No,No,No,Yes,No,No,No,No,No,No,No,No,No,No,No,No,No,No,No,No,No,No,No,No,No,Yes,No,No,No,No,No,No,No,No,No,No,No,No,No,No,No,No,No,No,No,No,No,No,No,No,No,No,No,No
best way govern facilit equiti societi provid excel public educ everi one k- also communiti colleg subsid govern societi type worker need present futur whether construct occup comput tech medic role young peopl may find product way make live,Positivo,No,No,No,No,No,Yes,No,No,No,Yes,No,No,No,No,No,No,No,No,Yes,No,Yes,No,Yes,No,No,No,No,No,No,No,No,No,No,No,No,No,No,No,No,Yes,No,No,No,No,Yes,No,No,No,Yes,No,No,No,No,No,No,No,No,No,No,No,No,Yes,No,No,No,No,Yes,No,No,No,No,No,No,No,Yes
seem reason part town barren resid low incom dispos incom use pay bare minimum water,Positivo,Yes,No,Yes,No,No,No,No,No,No,No,No,No,No,No,No,No,No,No,No,No,No,No,No,No,No,No,No,No,No,No,No,No,No,No,No,Yes,No,No,No,No,Yes,No,No,No,No,No,No,No,No,No,No,Yes,No,No,No,No,No,No,No,No,No,No,Yes,No,No,No,No,No,No,No,No,No,No,No,No
n't see massiv tree plant program citi ever success solut problem found,Negativo,No,Yes,No,Yes,Yes,No,No,No,No,No,No,No,No,No,Yes,No,No,No,No,No,No,No,No,No,No,No,No,No,No,No,No,No,No,No,No,No,No,No,No,No,No,No,No,No,No,No,No,No,No,No,No,No,Yes,No,Yes,No,Yes,Yes,No,No,No,No,No,No,No,No,No,No,No,No,No,No,No,No,No
mayb start drought adapt nativ street tree water citi expens charg low incom resid low water fee plant desert tree,Positivo,Yes,Yes,No,Yes,Yes,No,No,No,No,No,No,No,No,No,No,No,No,No,No,No,No,No,No,No,No,No,No,No,No,No,No,No,No,No,No,Yes,No,No,No,No,Yes,No,No,No,No,No,No,No,No,No,No,Yes,No,No,No,No,No,No,No,No,No,No,No,No,No,No,No,No,No,No,No,No,No,No,No
grass orpin tree,Negativo,No,No,No,Yes,No,No,No,No,No,No,No,No,No,No,No,No,No,No,No,No,No,No,No,No,No,No,No,No,No,No,No,No,No,No,No,No,No,No,No,No,No,No,No,No,No,No,No,No,No,No,No,No,No,No,No,No,No,No,No,Yes,No,No,No,No,No,No,No,No,No,No,No,No,No,No,No
legal promot humanur compost human wast site rather flush gallon precious drink water day,Positivo,Yes,No,No,No,No,No,Yes,No,Yes,No,No,No,No,Yes,No,No,No,No,No,No,No,No,No,No,No,No,No,No,No,No,No,No,No,No,No,No,No,No,No,No,No,No,No,No,No,No,No,No,No,No,No,No,No,No,No,No,No,No,No,No,No,No,No,No,No,No,No,No,No,No,No,No,No,No,No
green build live wall rooftop garden local energi product local water energi reus,Positivo,Yes,No,No,No,No,No,No,No,No,No,No,Yes,No,No,No,No,No,No,No,No,No,No,No,No,No,No,No,No,No,No,No,No,No,No,No,No,No,No,No,No,No,No,No,No,No,No,No,No,No,Yes,No,No,No,No,No,No,No,No,No,No,No,No,No,No,No,No,No,No,No,No,No,No,No,No,No
pleas discourag plant green grass desert stop plant new green grass unnecessari place green grass aw non-nat use much water,Positivo,Yes,No,Yes,No,Yes,No,No,No,No,No,No,Yes,No,No,No,No,No,No,No,No,No,Yes,No,No,No,Yes,No,No,No,No,No,No,No,No,No,No,No,No,No,No,No,No,Yes,No,No,No,No,No,No,No,No,No,No,No,No,No,No,No,No,Yes,No,No,No,No,No,No,No,No,No,No,No,No,No,No,No
nativ landscap use much less water still provid cool effect co exchang shade,Positivo,Yes,No,Yes,No,No,No,No,No,No,No,No,No,No,No,No,No,No,No,No,No,No,Yes,No,No,No,No,Yes,No,No,No,No,No,No,Yes,No,No,No,No,No,No,No,No,No,No,No,No,No,No,Yes,No,No,No,No,No,No,No,No,No,No,No,No,No,No,No,No,No,No,No,No,No,No,No,No,No,No
. recycl compost recycl plastic allow newspap offic paper mail cardboard also collect glass take ward offic recycl take groceri store plastic bag back groceri store case realli recycl,Positivo,No,No,No,No,No,No,No,Yes,Yes,No,No,No,No,No,No,No,No,No,No,No,No,No,No,No,No,No,No,No,No,No,No,No,No,No,No,No,No,No,No,No,No,No,No,No,No,No,No,No,No,No,No,No,No,No,No,No,No,No,No,No,Yes,No,No,No,No,No,Yes,No,No,No,No,No,No,Yes,No
compost n't use 'm concern city-wid compost pick-up system would end lot non-compost wast caus problem urban wildlif javelina pick often enough,Positivo,No,No,Yes,No,No,No,Yes,No,Yes,No,No,No,Yes,No,No,No,No,No,No,No,No,No,No,No,No,No,No,No,No,No,No,No,No,No,No,No,No,No,No,No,No,No,No,No,No,No,No,No,No,No,No,No,Yes,No,No,No,No,No,No,No,No,No,No,No,No,No,No,No,No,No,No,No,No,No,No
place close could take compost wast food wast yard wast place open sever day week -- would collect compost wast take think ua compost cat place one take compost -- look shut,Positivo,No,No,No,No,No,No,Yes,Yes,Yes,No,No,No,Yes,No,No,No,Yes,No,Yes,No,No,No,No,No,No,No,No,No,No,No,No,Yes,No,No,No,No,No,No,No,No,No,No,Yes,No,No,No,No,No,No,No,No,No,No,No,No,No,No,No,No,No,No,No,No,No,No,No,No,No,No,No,No,Yes,No,No,No
websit make look compost cat partner citi somehow special peopl take wast someplac expand advertis water bill https //sustainability.arizona.edu/projects/compost-cat,Negativo,Yes,Yes,No,No,No,No,Yes,Yes,Yes,Yes,No,No,No,No,No,No,Yes,No,No,No,No,No,Yes,No,No,No,No,No,No,No,No,No,No,No,No,No,No,No,No,No,No,Yes,No,No,No,No,No,No,No,No,No,No,No,No,No,No,No,No,Yes,No,No,No,No,No,No,No,No,No,No,No,No,Yes,No,No,No
. restaur take-out -- would great citi would encourag restaur take place use compost contain pandem tri support local restaur use go sit-down dine coffe etc want continu go howev contain food come often styrofoam plastic contain,Positivo,No,Yes,Yes,No,No,No,No,Yes,Yes,No,No,No,Yes,No,No,No,No,No,No,No,No,No,No,No,No,No,No,No,No,Yes,No,Yes,No,No,Yes,No,No,No,No,No,No,No,Yes,No,No,No,No,No,No,No,No,No,No,No,No,No,No,No,No,No,Yes,No,No,No,No,No,No,No,Yes,No,No,No,No,No,No
n't use styrofoam cup contain -- drown lid plastic contain wish knew place give plastic contain away -- way need store food keep leftov etc put reusabl plastic contain recycl seem terribl wast,Positivo,No,No,Yes,No,No,Yes,Yes,No,No,No,No,No,No,No,No,No,No,No,No,No,No,No,No,No,No,No,No,No,No,Yes,No,Yes,No,No,No,No,No,No,No,No,No,No,Yes,No,No,No,No,No,No,No,No,No,No,Yes,No,No,No,No,No,No,Yes,No,No,No,No,No,No,No,No,No,No,No,No,Yes,No
. e-scoot litter landscap sidewalk good solut mani us expand light-rail improv bus servic advertis,Negativo,No,No,No,No,No,No,No,No,No,No,No,No,No,No,No,No,No,No,No,No,No,No,No,Yes,No,No,No,No,No,No,Yes,No,No,Yes,No,No,No,Yes,No,No,No,Yes,No,No,No,No,No,No,No,No,No,No,No,No,No,No,Yes,No,No,No,No,No,No,No,No,No,No,No,No,Yes,Yes,No,No,No,No
. buse -- fix shade structur bus stop look upside-down umbrella bus stop along expand grant road project west first/euclid whenev pass shade stop instal non-funct architectur wonder bus stop put real shade structur instead,Positivo,No,No,No,No,No,No,No,No,No,No,No,No,No,No,No,No,Yes,No,No,No,No,No,No,No,No,Yes,Yes,No,No,No,Yes,No,No,No,No,No,No,No,No,No,No,No,No,No,No,No,No,No,No,No,No,No,No,Yes,No,No,No,No,No,No,No,No,No,No,No,No,No,No,No,No,No,No,No,No,No
blue coated-met shade structur provid shade much day think revis re-ori offer shade throughout day want increas bus ridership someth peopl n't bake desert sun wait bus,Positivo,No,No,No,No,No,No,No,No,No,Yes,No,No,No,No,No,No,No,No,No,No,No,Yes,No,No,No,No,Yes,No,No,No,Yes,No,No,No,No,No,No,No,No,No,No,No,No,No,No,No,No,No,Yes,No,No,No,No,No,No,No,No,No,No,No,No,No,No,No,No,No,No,No,No,No,No,No,No,No,No
feel whole survey mayor 's attempt give govern much space live benefici tucsonan issu address govern,Negativo,No,No,No,No,No,No,No,No,No,No,No,No,No,No,No,No,No,No,No,No,No,Yes,No,No,No,No,No,No,Yes,No,No,No,No,No,No,No,Yes,No,No,No,No,No,No,No,Yes,No,No,No,No,No,No,No,No,No,No,No,No,No,No,No,No,No,No,No,No,No,No,No,No,No,No,No,No,No,No
believ climat chang farc whatev happen scienc resent mayor 's attempt make everyth race issu america communist countri mayor want us,Negativo,No,No,No,No,No,No,No,No,No,No,No,No,No,No,No,Yes,No,Yes,No,No,No,No,Yes,No,No,No,No,No,Yes,No,No,No,No,No,No,No,No,No,No,No,No,No,No,No,No,No,No,No,No,No,No,No,No,No,No,No,No,No,No,No,No,No,No,No,No,No,No,No,No,No,Yes,No,No,No,No
legal method enter unit state mayor encourag sanctuari citi etc show complet disregard constitut american citizen,Negativo,No,Yes,No,No,No,No,No,No,No,No,No,No,No,No,No,No,No,No,No,No,No,No,No,No,No,No,No,No,Yes,No,No,No,No,No,No,No,No,No,No,No,No,No,No,No,No,No,No,No,No,No,No,No,No,No,No,Yes,No,No,No,No,No,No,No,No,No,Yes,No,No,Yes,No,No,No,No,No,No
