answer,sentiment,water,citi,use,tree,plant,need,wast,take,compost,peopl,tucson,green,would,promot,program,chang,look,climat,one,information_technolog,communiti,much,make,mani,solar,stop,shade,reduc,mayor,contain,bus,food,avail,landscap,support,resid,space,servic,get,public,low,advertis,place,afford,govern,like,car,group,provid,energi,heat,incom,problem,put,success,citizen,solut,see,bill,grass,plastic,equiti,part,exist,plan,constitut,also,iodin,encourag,good,us,cat,black,recycl,educ
tree requir much water root impact sewer line food wast need garbag promot breakdown garbag landfil put solar panel lightweight thin piec tinfoil inexpens panel becom avail,Negativo,Yes,No,No,Yes,No,Yes,Yes,No,No,No,No,No,No,Yes,No,No,No,No,No,No,No,Yes,No,No,Yes,No,No,No,No,No,No,Yes,Yes,No,No,No,No,No,No,No,No,No,No,No,No,No,No,No,No,No,No,No,No,Yes,No,No,No,No,No,No,No,No,No,No,No,No,No,No,No,No,No,No,No,No,No
would like see commut car china small batteri power car promot,Negativo,No,No,No,No,No,No,No,No,No,No,No,No,Yes,Yes,No,No,No,No,No,No,No,No,No,No,No,No,No,No,No,No,No,No,No,No,No,No,No,No,No,No,No,No,No,No,No,Yes,Yes,No,No,No,No,No,No,No,No,No,No,Yes,No,No,No,No,No,No,No,No,No,No,No,No,No,No,No,No,No
program help resid commerci owner reduc water use,Negativo,Yes,No,Yes,No,No,No,No,No,No,No,No,No,No,No,Yes,No,No,No,No,No,No,No,No,No,No,No,No,Yes,No,No,No,No,No,No,No,Yes,No,No,No,No,No,No,No,No,No,No,No,No,No,No,No,No,No,No,No,No,No,No,No,No,No,No,No,No,No,No,No,No,No,No,No,No,No,No,No
part citizen busi part best,Negativo,No,No,No,No,No,No,No,No,No,No,No,No,No,No,No,No,No,No,No,No,No,No,No,No,No,No,No,No,No,No,No,No,No,No,No,No,No,No,No,No,No,No,No,No,No,No,No,No,No,No,No,No,No,No,No,Yes,No,No,No,No,No,No,Yes,No,No,No,No,No,No,No,No,No,No,No,No
wife handicap senior,Negativo,No,No,No,No,No,No,No,No,No,No,No,No,No,No,No,No,No,No,No,No,No,No,No,No,No,No,No,No,No,No,No,No,No,No,No,No,No,No,No,No,No,No,No,No,No,No,No,No,No,No,No,No,No,No,No,No,No,No,No,No,No,No,No,No,No,No,No,No,No,No,No,No,No,No,No
live barrio viejo would love see need sidewalks/walk path shade communiti garden rentabl plot like citi would welcom,Positivo,No,Yes,No,No,No,Yes,No,No,No,No,No,No,Yes,No,No,No,No,No,No,No,Yes,No,No,No,No,No,Yes,No,No,No,No,No,No,No,No,No,No,No,No,No,No,No,No,No,No,Yes,No,No,No,No,No,No,No,No,No,No,No,Yes,No,No,No,No,No,No,No,No,No,No,No,No,No,No,No,No,No
would like make green space facin home take respons hand,Positivo,No,No,No,No,No,No,No,Yes,No,No,No,Yes,Yes,No,No,No,No,No,No,No,No,No,Yes,No,No,No,No,No,No,No,No,No,No,No,No,No,Yes,No,No,No,No,No,No,No,No,Yes,No,No,No,No,No,No,No,No,No,No,No,No,No,No,No,No,No,No,No,No,No,No,No,No,No,No,No,No,No
vote whomev strongest intellig approach prepar us environment disast happen,Positivo,No,No,No,No,No,No,No,No,No,No,No,No,No,No,No,No,No,No,No,No,No,No,No,No,No,No,No,No,No,No,No,No,No,No,No,No,No,No,No,No,No,No,No,No,No,No,No,No,No,No,No,No,No,No,No,No,No,No,No,No,No,No,No,No,No,No,No,No,No,No,Yes,No,No,No,No
alreadi solar panel sever citrus tree mani rose bush,Positivo,No,No,No,Yes,No,No,No,No,No,No,No,No,No,No,No,No,No,No,No,No,No,No,No,Yes,Yes,No,No,No,No,No,No,No,No,No,No,No,No,No,No,No,No,No,No,No,No,No,No,No,No,No,No,No,No,No,No,No,No,No,No,No,No,No,No,No,No,No,No,No,No,No,No,No,No,No,No
water much bigger problem survey realli allow pleas take account realiti overus water decreas avail wont us take eg colorado,Positivo,Yes,No,No,No,No,No,No,Yes,No,No,No,No,No,No,No,No,No,No,No,No,No,Yes,No,No,No,No,No,No,No,No,No,No,Yes,No,No,No,No,No,No,No,No,No,No,No,No,No,No,No,No,No,No,No,Yes,No,No,No,No,No,No,No,No,No,No,No,No,No,No,No,No,No,Yes,No,No,No,No
'm suggest low hang fruit celebr public success tucson complex communiti resid mani background level educ age incom ethnic variabl,Negativo,No,No,No,No,No,No,No,No,No,No,Yes,No,No,No,No,No,No,No,No,No,Yes,No,No,Yes,No,No,No,No,No,No,No,No,No,No,No,Yes,No,No,No,Yes,Yes,No,No,No,No,No,No,No,No,No,No,Yes,No,No,Yes,No,No,No,No,No,No,No,No,No,No,No,No,No,No,No,No,No,No,No,Yes
sad whole countri polar peopl reject climat scienc citi 's effort need nuanc inclus good luck,Negativo,No,Yes,No,No,No,Yes,No,No,No,Yes,No,No,No,No,No,No,No,Yes,No,No,No,No,No,No,No,No,No,No,No,No,No,No,No,No,No,No,No,No,No,No,No,No,No,No,No,No,No,No,No,No,No,No,No,No,No,No,No,No,No,No,No,No,No,No,No,No,No,No,No,Yes,No,No,No,No,No
hire train landscap crew know proper prune nativ tree shrub maintain nativ landscap identifi nativ plant,Positivo,No,No,No,Yes,Yes,No,No,No,No,No,No,No,No,No,No,No,No,No,No,No,No,No,No,No,No,No,No,No,No,No,No,No,No,Yes,No,No,No,No,No,No,No,No,No,No,No,No,No,No,No,No,No,No,No,No,No,No,No,No,No,No,No,No,No,No,No,No,No,No,No,No,No,No,No,No,No
thank implement appreci look forward get involv,Positivo,No,No,No,No,No,No,No,No,No,No,No,No,No,No,No,No,Yes,No,No,No,No,No,No,No,No,No,No,No,No,No,No,No,No,No,No,No,No,No,Yes,No,No,No,No,No,No,No,No,No,No,No,No,No,No,No,No,No,No,No,No,No,No,No,No,No,No,No,No,No,No,No,No,No,No,No,No
common sens hard find reus phoenix wast water plant tree harvest sun rain electrifi bus rout batteri n't put super hero cape roll disastr polici name environ,Negativo,Yes,No,No,Yes,Yes,No,Yes,No,No,No,No,No,No,No,No,No,No,No,No,No,No,No,No,No,No,No,No,No,No,No,Yes,No,No,No,No,No,No,No,No,No,No,No,No,No,No,No,No,No,No,No,No,No,No,Yes,No,No,No,No,No,No,No,No,No,No,No,No,No,No,No,No,No,No,No,No,No
hoa 's author citi,Negativo,No,Yes,No,No,No,No,No,No,No,No,No,No,No,No,No,No,No,No,No,No,No,No,No,No,No,No,No,No,No,No,No,No,No,No,No,No,No,No,No,No,No,No,No,No,No,No,No,No,No,No,No,No,No,No,No,No,No,No,No,No,No,No,No,No,No,No,No,No,No,No,No,No,No,No,No
thank survey,Positivo,No,No,No,No,No,No,No,No,No,No,No,No,No,No,No,No,No,No,No,No,No,No,No,No,No,No,No,No,No,No,No,No,No,No,No,No,No,No,No,No,No,No,No,No,No,No,No,No,No,No,No,No,No,No,No,No,No,No,No,No,No,No,No,No,No,No,No,No,No,No,No,No,No,No,No
thank progress polici one big reason decid move famili tucson,Positivo,No,No,No,No,No,No,No,No,No,No,Yes,No,No,No,No,No,No,No,Yes,No,No,No,No,No,No,No,No,No,No,No,No,No,No,No,No,No,No,No,No,No,No,No,No,No,No,No,No,No,No,No,No,No,No,No,No,No,No,No,No,No,No,No,No,No,No,No,No,No,No,No,No,No,No,No,No
keep use social media promot exist cot rebat program 's easi way get word thank plan futur peopl planet profit,Positivo,No,No,Yes,No,No,No,No,No,No,Yes,No,No,No,Yes,Yes,No,No,No,No,No,No,No,No,No,No,No,No,No,No,No,No,No,No,No,No,No,No,No,Yes,No,No,No,No,No,No,No,No,No,No,No,No,No,No,No,No,No,No,No,No,No,No,No,No,Yes,Yes,No,No,No,No,No,No,No,No,No,No
gratitud survey effort mayor council,Positivo,No,No,No,No,No,No,No,No,No,No,No,No,No,No,No,No,No,No,No,No,No,No,No,No,No,No,No,No,Yes,No,No,No,No,No,No,No,No,No,No,No,No,No,No,No,No,No,No,No,No,No,No,No,No,No,No,No,No,No,No,No,No,No,No,No,No,No,No,No,No,No,No,No,No,No,No
tucson part walkabl suffic promot less person car use besid look base_hit iodin exist amaz number accid pedestrian particip black,Negativo,No,No,Yes,No,No,No,No,No,No,No,Yes,No,No,Yes,No,No,Yes,No,No,No,No,No,No,No,No,No,No,No,No,No,No,No,No,No,No,No,No,No,No,No,No,No,No,No,No,No,Yes,No,No,No,No,No,No,No,No,No,No,No,No,No,No,No,Yes,Yes,No,No,No,Yes,No,No,No,No,Yes,No,No
fine pot operating_room landscap water use incl golf cours dress n't adequ water necessit aggress protect information_technolog use,Negativo,Yes,No,Yes,No,No,No,No,No,No,No,No,No,No,No,No,No,No,No,No,Yes,No,No,No,No,No,No,No,No,No,No,No,No,No,Yes,No,No,No,No,No,No,No,No,No,No,No,No,No,No,No,No,No,No,No,No,No,No,No,No,No,No,No,No,No,No,No,No,No,No,No,No,No,No,No,No,No
one intend embodi countri tax credit avail oeuvr alik recognit avail department_of_st oregon astatin feder grade electr vehicl purchas operating_room initi charger infrastructur,Negativo,No,No,No,No,No,No,No,No,No,No,No,No,No,No,No,No,No,No,Yes,No,No,No,No,No,No,No,No,No,No,No,No,No,Yes,No,No,No,No,No,No,No,No,No,No,No,No,No,No,No,No,No,No,No,No,No,No,No,No,No,No,No,No,No,No,No,No,No,No,No,No,No,No,No,No,No,No
practic race climat chang iodin spirit ahead sun heat toilet becom nice tangent,Negativo,No,No,No,No,No,No,No,No,No,No,No,No,No,No,No,Yes,No,Yes,No,No,No,No,No,No,No,No,No,No,No,No,No,No,No,No,No,No,No,No,No,No,No,No,No,No,No,No,No,No,No,No,Yes,No,No,No,No,No,No,No,No,No,No,No,No,No,No,No,No,Yes,No,No,No,No,No,No,No
mismanag nation afforest constitut huge lawsuit addit wildfir,Negativo,No,No,No,No,No,No,No,No,No,No,No,No,No,No,No,No,No,No,No,No,No,No,No,No,No,No,No,No,No,No,No,No,No,No,No,No,No,No,No,No,No,No,No,No,No,No,No,No,No,No,No,No,No,No,No,No,No,No,No,No,No,No,No,No,No,Yes,No,No,No,No,No,No,No,No,No
build water captur gutter contain bore water plant sphere get rid heat bubbl black pitch asphalt,Negativo,Yes,No,No,No,Yes,No,No,No,No,No,No,No,No,No,No,No,No,No,No,No,No,No,No,No,No,No,No,No,No,Yes,No,No,No,No,No,No,No,No,Yes,No,No,No,No,No,No,No,No,No,No,No,Yes,No,No,No,No,No,No,No,No,No,No,No,No,No,No,No,No,No,No,No,No,No,Yes,No,No
induct green infrastructur volit result indium job help economi,Negativo,No,No,No,No,No,No,No,No,No,No,No,Yes,No,No,No,No,No,No,No,No,No,No,No,No,No,No,No,No,No,No,No,No,No,No,No,No,No,No,No,No,No,No,No,No,No,No,No,No,No,No,No,No,No,No,No,No,No,No,No,No,No,No,No,No,No,No,No,No,No,No,No,No,No,No,No
leav benefit histor depriv group beggar racial equiti environ indecipher constitut enforc operating_room information_technolog would affect decis exist made,Negativo,No,No,No,No,No,No,No,No,No,No,No,No,Yes,No,No,No,No,No,No,Yes,No,No,No,No,No,No,No,No,No,No,No,No,No,No,No,No,No,No,No,No,No,No,No,No,No,No,No,Yes,No,No,No,No,No,No,No,No,No,No,No,No,No,Yes,No,Yes,No,Yes,No,No,No,No,No,No,No,No,No
resourc use cost resourc use topic world_health_organ habit information_technolog information_technolog constitut imper afford fair opportun underrepres group arsenic major group,Negativo,No,No,Yes,No,No,No,No,No,No,No,No,No,No,No,No,No,No,No,No,Yes,No,No,No,No,No,No,No,No,No,No,No,No,No,No,No,No,No,No,No,No,No,No,No,Yes,No,No,No,Yes,No,No,No,No,No,No,No,No,No,No,No,No,No,No,No,No,No,Yes,No,No,No,No,No,No,No,No,No
citi tucson must leav support legal citizen ahead hold program refuge illeg immigr,Negativo,No,Yes,No,No,No,No,No,No,No,No,Yes,No,No,No,Yes,No,No,No,No,No,No,No,No,No,No,No,No,No,No,No,No,No,No,No,Yes,No,No,No,No,No,No,No,No,No,No,No,No,No,No,No,No,No,No,No,No,Yes,No,No,No,No,No,No,No,No,No,No,No,No,No,No,No,No,No,No,No
citi exist care nerve-rack resolv troubl disadvantag mani servic success put_up asid ngos/non-profit information_technolog embodi citi 's charact social servic agenc play robin hood,Negativo,No,Yes,No,No,No,No,No,No,No,No,No,No,No,No,No,No,No,No,No,Yes,No,No,No,Yes,No,No,No,No,No,No,No,No,No,No,No,No,No,Yes,No,No,No,No,No,No,No,No,No,No,No,No,No,No,No,No,Yes,No,No,No,No,No,No,No,No,Yes,No,No,No,No,No,No,No,No,No,No,No
natur gas bill systemat cheap bill iodin perplex equal n't motion afford,Negativo,No,No,No,No,No,No,No,No,No,No,No,No,No,No,No,No,No,No,No,No,No,No,No,No,No,No,No,No,No,No,No,No,No,No,No,No,No,No,No,No,No,No,No,Yes,No,No,No,No,No,No,No,No,No,No,No,No,No,No,Yes,No,No,No,No,No,No,No,No,Yes,No,No,No,No,No,No,No
stop implant palo verd tree indiana citi mani peopl exist allerg,Negativo,No,Yes,No,Yes,No,No,No,No,No,Yes,No,No,No,No,No,No,No,No,No,No,No,No,No,Yes,No,Yes,No,No,No,No,No,No,No,No,No,No,No,No,No,No,No,No,No,No,No,No,No,No,No,No,No,No,No,No,No,No,No,No,No,No,No,No,No,Yes,No,No,No,No,No,No,No,No,No,No,No
intend `` promot `` extend tax bonus lyric embodi fabul fuzzi iodin see angstrom govern grandios plan information_technolog look like person someth make information_technolog possibl experi meet committe paper write draw promot achiev absolut noth peopl,Negativo,No,No,No,No,No,No,No,No,No,Yes,No,No,No,Yes,No,No,Yes,No,No,Yes,No,No,Yes,No,No,No,No,No,No,No,No,No,No,No,No,No,No,No,No,No,No,No,No,No,Yes,Yes,No,No,No,No,No,No,No,No,No,No,No,Yes,No,No,No,No,No,No,Yes,No,No,Yes,No,No,No,No,No,No,No
dress n't see massiv tree plant program citi buttock ever beryllium success solut problem find,Negativo,No,Yes,No,Yes,Yes,No,No,No,No,No,No,No,No,No,Yes,No,No,No,No,No,No,No,No,No,No,No,No,No,No,No,No,No,No,No,No,No,No,No,No,No,No,No,No,No,No,No,No,No,No,No,No,No,Yes,No,Yes,No,Yes,Yes,No,No,No,No,No,No,No,No,No,No,No,No,No,No,No,No,No
grass orpin tree,Negativo,No,No,No,Yes,No,No,No,No,No,No,No,No,No,No,No,No,No,No,No,No,No,No,No,No,No,No,No,No,No,No,No,No,No,No,No,No,No,No,No,No,No,No,No,No,No,No,No,No,No,No,No,No,No,No,No,No,No,No,No,Yes,No,No,No,No,No,No,No,No,No,No,No,No,No,No,No
web_sit make information_technolog look adenin compost cat partner citi somehow special peopl take neutral somewher oregon earli approxim elabor advertis information_technolog indium water bill hypertext_transfer_protocol //sustainability.arizona.edu/projects/compost-cat,Negativo,Yes,Yes,No,No,No,No,No,Yes,Yes,Yes,No,No,No,No,No,No,Yes,No,No,Yes,No,No,Yes,No,No,No,No,No,No,No,No,No,No,No,No,No,No,No,No,No,No,Yes,No,No,No,No,No,No,No,No,No,No,No,No,No,No,No,No,Yes,No,No,No,No,No,No,No,No,No,No,No,No,Yes,No,No,No
three e-scoot litter landscap sidewalk good solut mani uranium elabor light-rail better bus servic advertis information_technolog,Negativo,No,No,No,No,No,No,No,No,No,No,No,No,No,No,No,No,No,No,No,Yes,No,No,No,Yes,No,No,No,No,No,No,Yes,No,No,Yes,No,No,No,Yes,No,No,No,Yes,No,No,No,No,No,No,No,No,No,No,No,No,No,No,Yes,No,No,No,No,No,No,No,No,No,No,No,No,Yes,No,No,No,No,No
iodin feel solid survey mayor 's undertak give govern excess a_lot space anim astatin benefici tucsonan write_out cost address asid polit,Negativo,No,No,No,No,No,No,No,No,No,No,No,No,No,No,No,No,No,No,No,No,No,No,No,No,No,No,No,No,Yes,No,No,No,No,No,No,No,Yes,No,No,No,No,No,No,No,Yes,No,No,No,No,No,No,No,No,No,No,No,No,No,No,No,No,No,No,No,No,No,No,Yes,No,No,No,No,No,No,No
one believ climat exchang farc happen skill one begrudg mayor 's attempt make everyth race consequ america cost communist nation constitut mayor want uranium,Negativo,No,No,No,No,No,No,No,No,No,No,No,No,No,No,No,No,No,Yes,Yes,No,No,No,Yes,No,No,No,No,No,Yes,No,No,No,No,No,No,No,No,No,No,No,No,No,No,No,No,No,No,No,No,No,No,No,No,No,No,No,No,No,No,No,No,No,No,No,No,Yes,No,No,No,No,No,No,No,No,No
legal method_act enter unit state mayor encourag refug citi etc show complet disregard constitut american citizen,Negativo,No,Yes,No,No,No,No,No,No,No,No,No,No,No,No,No,No,No,No,No,No,No,No,No,No,No,No,No,No,Yes,No,No,No,No,No,No,No,No,No,No,No,No,No,No,No,No,No,No,No,No,No,No,No,No,No,No,Yes,No,No,No,No,No,No,No,No,No,Yes,No,No,Yes,No,No,No,No,No,No
tree want excess much water solut impact gutter line food wast equal necessit inch garbag advertis disloc drivel indiana landfil one put_opt solar gore lightweight spars angstrom nibbl tinfoil cheap gore becom avail,Negativo,Yes,No,No,Yes,No,No,Yes,No,No,No,No,No,No,No,No,No,No,No,Yes,No,No,Yes,No,No,Yes,No,No,No,No,No,No,Yes,Yes,No,No,No,No,No,No,No,No,Yes,No,No,No,No,No,No,No,No,No,No,No,No,No,No,Yes,No,No,No,No,No,No,No,No,No,No,No,No,No,No,No,No,No,No
would like experi commut car china equal small batteri power car advertis,Negativo,No,No,No,No,No,No,No,No,No,No,No,No,Yes,No,No,No,No,No,No,No,No,No,No,No,No,No,No,No,No,No,No,No,No,No,No,No,No,No,No,No,No,Yes,No,No,No,Yes,Yes,No,No,No,No,No,No,No,No,No,No,No,No,No,No,No,No,No,No,No,No,No,No,No,No,No,No,No,No
program serv resid commerci owner reduc water use,Negativo,Yes,No,Yes,No,No,No,No,No,No,No,No,No,No,No,Yes,No,No,No,No,No,No,No,No,No,No,No,No,Yes,No,No,No,No,No,No,No,Yes,No,No,No,No,No,No,No,No,No,No,No,No,No,No,No,No,No,No,No,No,No,No,No,No,No,No,No,No,No,No,No,No,No,No,No,No,No,No,No
one part citizen busi doctor_of_osteopathi separ arsenic well toilet,Negativo,No,No,No,No,No,No,No,No,No,No,No,No,No,No,No,No,No,No,Yes,No,No,No,No,No,No,No,No,No,No,No,No,No,No,No,No,No,No,No,No,No,No,No,No,No,No,No,No,No,No,No,No,No,No,No,No,Yes,No,No,No,No,No,No,Yes,No,No,No,No,No,No,No,No,No,No,No,No
wife iodin disabl elder,Negativo,No,No,No,No,No,No,No,No,No,No,No,No,No,No,No,No,No,No,No,No,No,No,No,No,No,No,No,No,No,No,No,No,No,No,No,No,No,No,No,No,No,No,No,No,No,No,No,No,No,No,No,No,No,No,No,No,No,No,No,No,No,No,No,No,No,No,No,Yes,No,No,No,No,No,No,No
one 'm suggest low attend fruit mere observ advertis success tucson complex communiti resid mani background floor educ age incom ethnic variable_star,Negativo,No,No,No,No,No,No,No,No,No,No,Yes,No,No,No,No,No,No,No,Yes,No,Yes,No,No,Yes,No,No,No,No,No,No,No,No,No,No,No,Yes,No,No,No,No,Yes,Yes,No,No,No,No,No,No,No,No,No,Yes,No,No,Yes,No,No,No,No,No,No,No,No,No,No,No,No,No,No,No,No,No,No,No,Yes
sad unharm nation polar peopl refus climat skill citi 's feat indig embodi nuanc inclus good luck,Negativo,No,Yes,No,No,No,No,No,No,No,Yes,No,No,No,No,No,No,No,Yes,No,No,No,No,No,No,No,No,No,No,No,No,No,No,No,No,No,No,No,No,No,No,No,No,No,No,No,No,No,No,No,No,No,No,No,No,No,No,No,No,No,No,No,No,No,No,No,No,No,No,No,Yes,No,No,No,No,No
coars feel equal heavili find reus phoenix wast water establish tree crop sunlight rain electrifi bus road batteri n't put_opt super hero cape roll forbidden black polici name environ,Negativo,Yes,No,No,Yes,No,No,Yes,No,No,No,No,No,No,No,No,No,No,No,No,No,No,No,No,No,No,No,No,No,No,No,Yes,No,No,No,No,No,No,No,No,No,No,No,No,No,No,No,No,No,No,No,No,No,No,No,No,No,No,No,No,No,No,No,No,No,No,No,No,No,No,No,No,No,Yes,No,No
hoa 's assur citi,Negativo,No,Yes,No,No,No,No,No,No,No,No,No,No,No,No,No,No,No,No,No,No,No,No,No,No,No,No,No,No,No,No,No,No,No,No,No,No,No,No,No,No,No,No,No,No,No,No,No,No,No,No,No,No,No,No,No,No,No,No,No,No,No,No,No,No,No,No,No,No,No,No,No,No,No,No,No
